English,Hindi,HinEnglish,Marathi,MarathiEnglish,Tamil,TamilEnglish,Japanese,Romanization
I'm on my way,मैं रास्ते में हूँ,Main raaste mein hoon,मी वाटेत आहे,Mi vaatet aahe,நான் வரும் வழியில் இருக்கிறேன்,Naan varum vazhiyil irukkiren,今向かってるよ,Ima mukatteru yo
Dinner is on me today,आज रात का खाना मेरी तरफ से है,Aaj raat ka khana meri taraf se hai,आजचे जेवण माझ्याकडून आहे,Aajche jevan mazhyakadun aahe,இன்று இரவு உணவுக்கு நான் செலவு செய்கிறேன்,Indru iravu unavukku naan selavu seigiren,今日の夕食は私がおごるよ,Kyō no yūshoku wa watashi ga ogoru yo
Let's talk about it,चलो इसके बारे में बात करते हैं,Chalo iske baare mein baat karte hain,चला याबद्दल बोलूया,Chala yaabaddal boluyya,இதைப் பற்றி பேசலாம்,Idhaip patri pesalam,それについて話そう,Sore ni tsuite hanasō
I'm here for you,मैं तुम्हारे साथ हूँ,Main tumhare saath hoon,मी तुझ्यासोबत आहे,Mi tuzhyasobat aahe,நான் உங்களுக்காக இருக்கிறேன்,Naan ungalukkaaga irukkiren,私はあなたの味方だよ,Watashi wa anata no mikata da yo
Can you pass me the remote?,क्या तुम मुझे रिमोट दे सकते हो?,Kya tum mujhe remote de sakte ho?,तू मला रिमोट देऊ शकतोस का?,Tu mala remote deu shaktos ka?,ரிமோட் எனக்குக் கொடுக்க முடியுமா?,Remote enakkuk kodukka mudiyuma?,リモコンを取ってくれる,Rimo-kon o totte kureru?
I'm a little worried,मैं थोड़ा चिंतित हूँ,Main thoda chintit hoon,मी थोडा काळजीत आहे,Mi thoda kaaljit aahe,நான் கொஞ்சம் கவலையாக இருக்கிறேன்,Naan konjam kavalaiyaaga irukkiren,少し心配だよ,Sukoshi shinpai da yo
Don't worry,चिंता मत करो,Chinta mat karo,काळजी करू नकोस,Kalji karu nakos,கவலைப்படாதே,Kavalaippadaade,心配しないで,Shinpai shinaide
I need to be alone,मुझे अकेला रहना है,Mujhe akela rehna hai,मला एकटे राहायचे आहे,Mala ekte rahayche aahe,நான் தனியாக இருக்க வேண்டும்,Naan thaniyaaga irukka vendum,一人にさせて,Hitori ni sasete
What do you think?,तुम्हें क्या लगता है?,Tumhein kya lagta hai?,तुला काय वाटते?,Tula kay vaatte?,நீங்கள் என்ன நினைக்கிறீர்கள்?,Neengal enna ninaikkireergal?,どう思う,Dō omou?
I'm in a good mood,मैं अच्छे मूड में हूँ,Main achhe mood mein hoon,मी चांगल्या मूडमध्ये आहे,Mi changlya moodmadhye aahe,நான் நல்ல மனநிலையில் இருக்கிறேன்,Naan nalla mananilaiyil irukkiren,機嫌がいいよ,Kigen ga ii yo
I'm hungry,मुझे भूख लगी है,Mujhe bhookh lagi hai,मला भूक लागली आहे,Mala bhook lagli aahe,எனக்கு பசிக்கிறது,Enakku pasikkiradhu,お腹空いた,Onaka suita
I'm full,मेरा पेट भर गया है,Mera pet bhar gaya hai,माझे पोट भरले आहे,Majhe pot bharle aahe,என் வயிறு நிறைந்தது,En vayiru niraindhadhu,お腹いっぱい,Onaka ippai
Where are we going?,हम कहाँ जा रहे हैं?,Hum kahan jaa rahe hain?,आपण कुठे जात आहोत?,Aapan kuthe jaat aahot?,நாம் எங்கே போகிறோம்?,Naam enge pogirom?,どこに行くの,Doko ni iku no?
Are you okay?,क्या तुम ठीक हो?,Kya tum theek ho?,तू ठीक आहेस का?,Tu thik ahes ka?,நீ நலமாக இருக்கிறாயா?,Nee nalamaga irukkiraaya?,大丈夫,Daijōbu?
Let's go,चलो चलते हैं,Chalo chalte hain,चला जाऊया,Chala jaauya,நாம் போகலாம்,Naam pogalam,行こう,Ikō
I'm tired of this,मैं इससे थक गया हूँ,Main isse thak gaya hoon,मी याला कंटाळलो आहे,Mi yaala kantalalo aahe,நான் இதிலிருந்து சலித்துவிட்டேன்,Naan idhil irundhu saliththuvitten,もううんざりだ,Mō unzari da
I need some space,मुझे थोड़ी जगह चाहिए,Mujhe thodi jagah chahiye,मला थोडी जागा हवी आहे,Mala thodi jaga havi aahe,எனக்கு கொஞ்சம் இடம் வேண்டும்,Enakku konjam idam vendum,少し時間をちょうだい,Sukoshi jikan o chōdai
I'm just teasing,मैं तो बस छेड़ रहा था,Main to bas chhed raha tha,मी फक्त चिडवत होतो,Mi phakat chidvat hoto,நான் வெறும் கேலி செய்கிறேன்,Naan verum keli seigiren,からかってるだけだよ,Karakatteru dake da yo
I love you to the moon and back,मैं तुमसे चाँद पर जाकर वापस आने तक प्यार करता हूँ,Main tumse chaand par jaakar wapas aane tak pyaar karta hoon,मी तुझ्यावर चंद्रावर जाऊन परत येण्यापर्यंत प्रेम करतो,Mi tuzhyavar chandravar jaaun parat yenyaparyant prem karto,நான் உன்னை நிலவுக்குச் சென்று திரும்பி வரும் வரை நேசிக்கிறேன்,Naan unnai nilavukku sendru thirumbi varum varai nesikiren,月に行って帰ってくるくらい愛してる,Tsuki ni itte kaette kuru kurai aishiteru
You are my best friend,तुम मेरे सबसे अच्छे दोस्त हो,Tum mere sabse achhe dost ho,तू माझा सर्वात चांगला मित्र आहेस,Tu majha sarvat changla mitra ahes,நீ எனது சிறந்த நண்பன்,Nee enadhu sirandha nanban,あなたは私の親友だよ,Anata wa watashi no shinyū da yo
Let's clean the house,चलो घर की सफ़ाई करते हैं,Chalo ghar ki safaai karte hain,चला घर स्वच्छ करूया,Chala ghar svachchha karuya,வீட்டை சுத்தம் செய்வோம்,Veettai suththam seivom,家を掃除しよう,Ie o sōji shiyō
I miss the old days,मुझे पुराने दिन याद आते हैं,Mujhe purane din yaad aate hain,मला जुने दिवस आठवतात,Mala june divas aathvtat,எனக்கு பழைய நாட்கள் நினைவில் வருகிறது,Enakku pazhaiya naatkal ninaivil varugiradhu,昔が懐かしいな,Mukashi ga natsukashii na
What's your plan for the future?,भविष्य के लिए तुम्हारी क्या योजना है?,Bhavishya ke liye tumhari kya yojana hai?,भविष्यासाठी तुझी काय योजना आहे?,Bhavishyasaathi tuzhi kay yojana aahe?,எதிர்காலத்திற்கான உங்கள் திட்டம் என்ன?,Edhirkaalaththirkana ungal thittam enna?,将来の計画は何,Shōrai no keikaku wa nani?
Hello, Ma'am,नमस्ते, मैम,Namaste, Ma'am,नमस्कार, मॅडम,Namaskar, Madam,வணக்கம், அம்மா,Vanakkam, Amma,こんにちは、奥様,Konnichiwa, Okusama
Hello, Mami,नमस्ते, मामी जी,Namaste, Mami ji,नमस्कार, मामी,Namaskar, Mami,வணக்கம், மாமி,Vanakkam, Maami,こんにちは、おばさん,Konnichiwa, Obasan
Hello, Uncle,नमस्ते, अंकल जी,Namaste, Uncle ji,नमस्कार, काका,Namaskar, Kaka,வணக்கம், மாமா,Vanakkam, Maama,こんにちは、おじさん,Konnichiwa, Ojisan
Hello, Aunty,नमस्ते, आंटी जी,Namaste, Aunty ji,नमस्कार, काकू,Namaskar, Kaku,வணக்கம், அத்தை,Vanakkam, Athai,こんにちは、おばさん,Konnichiwa, Obasan
Hello, Big Brother,नमस्ते, भैया,Namaste, Bhaiya,नमस्कार, दादा,Namaskar, Dada,வணக்கம், அண்ணா,Vanakkam, Anna,こんにちは、お兄ちゃん,Konnichiwa, Oniichan
Hello, Big Sister,नमस्ते, दीदी,Namaste, Didi,नमस्कार, ताई,Namaskar, Tai,வணக்கம், அக்கா,Vanakkam, Akka,こんにちは、お姉ちゃん,Konnichiwa, Oneechan
How are you?,आप कैसी हैं?,Aap kaisi hain?,तुम्ही कशा आहात?,Tumhi kasha aahat?,நீங்கள் எப்படி இருக்கிறீர்கள்?,Neengal eppadi irukkireergal?,お元気ですか,Ogenki desu ka?
How was your day?,आपका दिन कैसा था?,Aapka din kaisa tha?,तुमचा दिवस कसा होता?,Tumcha divas kasa hota?,உங்கள் நாள் எப்படி இருந்தது?,Ungal naal eppadi irundhadhu?,今日はどうでしたか,Kyō wa dō deshita ka?
May I help you?,क्या मैं आपकी मदद कर सकता हूँ?,Kya main aapki madad kar sakta hoon?,मी तुम्हाला मदत करू शकतो का?,Mi tumhala madat karu shakto ka?,நான் உங்களுக்கு உதவலாமா?,Naan ungalukku udhavalama?,お手伝いしましょうか,O-tetsudai shimashō ka?
Please, have a seat,कृपया बैठिए,Kripya baithiye,कृपया बसा,Krupaya basa,தயவுசெய்து உட்காருங்கள்,Thayavuseidhu utkaarangal,どうぞおかけください,Dōzo o-kake kudasai
Thank you for everything,हर चीज़ के लिए धन्यवाद,Har cheez ke liye dhanyavaad,प्रत्येक गोष्टीसाठी धन्यवाद,Pratyek goshtisathi dhanyavaad,எல்லாவற்றிற்கும் நன்றி,Ellaavatrukkum nandri,いろいろとありがとうございます,Iroiro to arigatō gozaimasu
May I ask a question?,क्या मैं एक सवाल पूछ सकता हूँ?,Kya main ek sawaal pooch sakta hoon?,मी एक प्रश्न विचारू शकतो का?,Mi ek prashna vicharu shakto ka?,நான் ஒரு கேள்வி கேட்கலாமா?,Naan oru kelvi ketkalama?,質問してもいいですか,Shitsumon shite mo ii desu ka?
I'm so sorry,मुझे माफ़ कर दीजिए,Mujhe maaf kar deejiye,मला माफ करा,Mala maaf kara,மன்னிக்கவும்,Mannikkavum,本当にごめんなさい,Hontō ni gomen nasai
I appreciate your advice,आपकी सलाह के लिए धन्यवाद,Aapki salah ke liye dhanyavaad,तुमच्या सल्ल्याबद्दल धन्यवाद,Tumchya sallyabaddal dhanyavaad,உங்கள் ஆலோசனைக்கு நன்றி,Ungal aalosanai ku nandri,ご意見ありがとうございます,Go-iken arigatō gozaimasu
You are very kind,आप बहुत दयालु हैं,Aap bahut dayalu hain,तुम्ही खूप दयाळू आहात,Tumhi khup dayalu aahat,நீங்கள் மிகவும் அன்பானவர்,Neengal migavum anbaanavar,とても親切ですね,Totemo shinsetsu desu ne
Let's go for a walk,चलो टहलने चलते हैं,Chalo tahalne chalte hain,चला फिरायला जाऊया,Chala phirayala jaauya,நடந்து செல்லலாம்,Nadandu sellalam,散歩に行こうよ,Sanpo ni ikō yo
I'm glad you're here,आप यहाँ हैं, मुझे खुशी है,Aap yahan hain, mujhe khushi hai,तुम्ही इथे आहात, याचा मला आनंद आहे,Tumhi ithe aahat, yacha mala anand aahe,நீங்கள் இங்கே இருப்பது மகிழ்ச்சி,Neengal inge iruppadhu magizhchi,来てくれて嬉しいです,Kite kurete ureshii desu
What do you want to do today?,आज आप क्या करना चाहते हैं?,Aaj aap kya karna chahte hain?,आज तुम्हाला काय करायचे आहे?,Aaj tumhala kay karayche aahe?,இன்று என்ன செய்ய விரும்புகிறீர்கள்?,Indru enna seiya virumbugireergal?,今日は何をしたいですか,Kyō wa nani o shitai desu ka?
I respect your opinion,मैं आपकी राय का सम्मान करता हूँ,Main aapki raay ka samman karta hoon,मी तुमच्या मताचा आदर करतो,Mi tumchya matacha aadar karto,உங்கள் கருத்தை நான் மதிக்கிறேன்,Ungal karuthai naan madikkiren,あなたの意見を尊重します,Anata no iken o sonchō shimasu
I'm so proud of you,मुझे तुम पर बहुत गर्व है,Mujhe tum par bahut garv hai,मला तुझा खूप अभिमान आहे,Mala tuzha khup abhiman aahe,உன்னைப் பற்றி எனக்கு மிகவும் பெருமையாக இருக்கிறது,Unnaippatri enakku migavum perumaiyaaga irukkiradhu,あなたのことを誇りに思うよ,Anata no koto o hokori ni omou yo
Could you please pass the salt?,क्या आप नमक पास कर सकते हैं?,Kya aap namak pass kar sakte hain?,तुम्ही मीठ देऊ शकता का?,Tumhi meeth deu shakta ka?,தயவுசெய்து உப்பைக் கொடுக்க முடியுமா?,Thayavuseidhu uppai kodukka mudiyuma?,塩を取ってくれませんか,Shio o totte kuremasen ka?
I have a new idea,मेरे पास एक नया विचार है,Mere paas ek naya vichaar hai,माझ्याकडे एक नवीन कल्पना आहे,Mazhyakade ek navin kalpana aahe,என்னிடம் ஒரு புதிய யோசனை உள்ளது,Ennidam oru puthiya yosanai ulladhu,新しいアイデアがあるんだ,Atarashii aidea ga arunda
Can you give me some advice?,क्या आप मुझे कुछ सलाह दे सकते हैं?,Kya aap mujhe kuch salah de sakte hain?,तुम्ही मला काही सल्ला देऊ शकता का?,Tumhi mala kahi sallaah deu shakta ka?,நீங்கள் எனக்கு சில ஆலோசனை தர முடியுமா?,Neengal enakku sila aalosanai thara mudiyuma?,アドバイスをいただけますか,Adobaisu o itadakemasu ka?
What should we cook for dinner?,रात के खाने में हमें क्या बनाना चाहिए?,Raat ke khaane mein humein kya banana chahiye?,जेवणासाठी आपण काय बनवूया?,Jevanasathi aapan kay banavuyya?,இரவு உணவுக்கு நாம் என்ன சமைக்க வேண்டும்?,Iravu unavukku naam enna samaikka vendum?,夕食は何を作ろうか,Yūshoku wa nani o tsukurō ka?
I'm going to the market,मैं बाज़ार जा रहा हूँ,Main bazaar jaa raha hoon,मी बाजारात जात आहे,Mi baajaraat jaat aahe,நான் சந்தைக்குப் போகிறேன்,Naan sandhaikkup pogiren,市場に行ってくるね,Ichiba ni itte kuru ne
Can I borrow your car?,क्या मैं आपकी गाड़ी ले सकता हूँ?,Kya main aapki gaadi le sakta hoon?,मी तुमची गाडी घेऊ शकतो का?,Mi tumchi gadi gheu shakto ka?,நான் உங்கள் காரை எடுக்கலாமா?,Naan ungal kaarai edukkalam a?,車を借りてもいいですか,Kuruma o karite mo ii desu ka?
It's so good to see you,आपसे मिलकर बहुत अच्छा लगा,Aapse milkar bahut achha laga,तुम्हाला पाहून खूप छान वाटले,Tumhala paahoon khup chhaan vaatale,உங்களைப் பார்த்ததில் மகிழ்ச்சி,Ungalai paarththadhil magizhchi,お会いできてとても嬉しいです,O-ai dekite totemo ureshii desu
I'm here for you,मैं तुम्हारे साथ हूँ,Main tumhare saath hoon,मी तुझ्यासोबत आहे,Mi tuzhyasobat aahe,நான் உங்களுக்காக இருக்கிறேன்,Naan ungalukkaaga irukkiren,私はあなたの味方だよ,Watashi wa anata no mikata da yo
Let's talk about it,चलो इस बारे में बात करते हैं,Chalo is baare mein baat karte hain,चला याबद्दल बोलूया,Chala yaabaddal boluyya,இதைப் பற்றி பேசலாம்,Idhai patti pesalam,それについて話そう,Sore ni tsuite hanasō
I'm really tired today,आज मैं बहुत थका हुआ हूँ,Aaj main bahut thaka hua hoon,आज मी खूप थकून गेलो आहे,Aaj mi khup thakun gelo aahe,இன்று நான் மிகவும் களைப்பாக இருக்கிறேன்,Indru naan migavum kalaippaga irukkiren,今日はとても疲れたよ,Kyō wa totemo tsukareta yo
I brought you a gift,मैं आपके लिए एक तोहफा लाया हूँ,Main aapke liye ek tohfa laya hoon,मी तुमच्यासाठी एक भेट आणली आहे,Mi tumchyasathi ek bhet aanli aahe,நான் உங்களுக்கு ஒரு பரிசு கொண்டு வந்தேன்,Naan ungalukku oru parisu kondu vandhen,お土産を持ってきたよ,O-miyage o motte kita yo
What do you think?,आप क्या सोचते हैं?,Aap kya sochte hain?,तुम्ही काय विचार करता?,Tumhi kay vichar karta?,நீங்கள் என்ன நினைக்கிறீர்கள்?,Neengal enna ninaikkireergal?,どう思いますか,Dō omoimasu ka?
You're the best,आप सबसे अच्छे हैं,Aap sabse achhe hain,तुम्ही सर्वोत्तम आहात,Tumhi sarvottam aahat,நீங்கள் சிறந்தவர்,Neengal sirandhavar,あなたは最高だよ,Anata wa saikō da yo
I'll help you with the dishes,मैं बर्तन धोने में आपकी मदद करूँगा,Main bartan dhone mein aapki madad karunga,मी भांडी धुण्यात तुम्हाला मदत करेन,Mi bhandi dhunyat tumhala madat karen,நான் பாத்திரங்களை கழுவ உங்களுக்கு உதவுகிறேன்,Naan paaththirangalais kaluva ungalukku udhavugiren,お皿洗い手伝うよ,Osara arai tetsudau yo
Do you want me to get anything from the store?,क्या आप चाहते हैं कि मैं दुकान से कुछ ले आऊँ?,Kya aap chahte hain ki main dukaan se kuch le aaun?,मी दुकानातून काही आणू का?,Mi dukaanatun kahi aanu ka?,நான் கடைக்குச் சென்று ஏதாவது எடுத்து வரட்டுமா?,Naan kadaikku sendru edhaavadhu eduththu varattuma?,お店で何か買ってこようか,O-mise de nanika katte koyō ka?
Let's plan a family dinner,चलो एक पारिवारिक डिनर की योजना बनाते हैं,Chalo ek paarivarik dinner ki yojana banate hain,चला एक कौटुंबिक जेवण योजना करूया,Chala ek kautumbik jevan yojana karuya,நாம் ஒரு குடும்ப இரவு உணவை திட்டமிடுவோம்,Naam oru kudumba iravu unavai thittamidu vōm,家族で夕食の計画を立てよう,Kazoku de yūshoku no keikaku o tateyō
How is your work going?,आपका काम कैसा चल रहा है?,Aapka kaam kaisa chal raha hai?,तुमचे काम कसे चालू आहे?,Tumche kaam kase chalu aahe?,உங்கள் வேலை எப்படி போய்க்கொண்டிருக்கிறது?,Ungal velai eppadi pōykkondirukkiradhu?,お仕事はどうですか,O-shigoto wa dō desu ka?
Did you eat today?,क्या आपने आज खाना खाया?,Kya aapne aaj khaana khaaya?,तू आज जेवलास का?,Tu aaj jevlas ka?,இன்று சாப்பிட்டீர்களா?,Indru saapiddeergala?,今日、ご飯食べた,Kyō, gohan tabeta?
Let's watch a movie together,चलो साथ में एक फिल्म देखते हैं,Chalo saath mein ek film dekhte hain,चला एकत्र चित्रपट बघूया,Chala ekatra chitrapat baghuyya,நாம் ஒன்றாக ஒரு படம் பார்ப்போம்,Naam ondraga oru padam paarpom,一緒に映画を見ようよ,Issho ni eiga o miyō yo
I finished my project,मैंने अपना प्रोजेक्ट पूरा कर लिया,Maine apna project poora kar liya,मी माझा प्रकल्प पूर्ण केला,Mi mazha prakalp purna kela,நான் என் திட்டத்தை முடித்துவிட்டேன்,Naan en thittaththai mudiththuvitten,プロジェクトが終わったよ,Purojekuto ga owatta yo
How was your trip?,आपकी यात्रा कैसी रही?,Aapki yaatra kaisi rahi?,तुमचा प्रवास कसा होता?,Tumcha pravas kasa hota?,உங்கள் பயணம் எப்படி இருந்தது?,Ungal payanam eppadi irundhadhu?,旅行はどうだった,Ryokō wa dō datta?
I miss you guys,मुझे तुम सबकी याद आ रही है,Mujhe tum sabki yaad aa rahi hai,मला तुमची आठवण येत आहे,Mala tumchi aathvan yet aahe,உங்கள் அனைவரையும் நான் மிஸ் செய்கிறேன்,Ungal anaivaraiyum naan miss seigiren,みんなに会いたかったよ,Minna ni aitakatta yo
I love the stories you tell,मुझे आपकी कहानियाँ बहुत पसंद हैं,Mujhe aapki kahaniyaan bahut pasand hain,तुमच्या कथा मला खूप आवडतात,Tumchya katha mala khup aavdtat,நீங்கள் சொல்லும் கதைகள் எனக்கு மிகவும் பிடிக்கும்,Neengal sollum kadhaigal enakku migavum pidikkum,話してくれる物語が好きだよ,Hanashite kureru monogatari ga suki da yo
You always give the best advice,आप हमेशा सबसे अच्छी सलाह देते हैं,Aap hamesha sabse achhi salah dete hain,तुम्ही नेहमी सर्वोत्तम सल्ला देता,Tumhi nehami sarvottam sallaah deta,நீங்கள் எப்போதும் சிறந்த ஆலோசனைகளைத் தருகிறீர்கள்,Neengal eppodhum sirandha aalosanai galai tharugireergal,いつも最高のアドバイスをくれるよね,Itsumo saikō no adobaisu o kureru yo ne
Let's do this again,चलो यह फिर से करते हैं,Chalo yeh phir se karte hain,चला हे पुन्हा करूया,Chala he punha karuyya,இதை மீண்டும் செய்வோம்,Idhaim meendum seivom,またやろうね,Mata yarō ne
That was a fun memory,वह एक मजेदार याद थी,Woh ek majedaar yaad thi,ती एक मजेशीर आठवण होती,Ti ek majesheer aathvan hoti,அது ஒரு வேடிக்கையான நினைவு,Adhu oru vedikkaiyaana ninaivu,あれは楽しい思い出だったね,Are wa tanoshii omoide datta ne
I am a little worried about you,मैं आपके बारे में थोड़ा चिंतित हूँ,Main aapke baare mein thoda chintit hoon,मला तुमच्याबद्दल थोडी काळजी वाटत आहे,Mala tumchyabaddal thodi kalji vaatat aahe,உங்களைப் பற்றி நான் சற்று கவலையாக இருக்கிறேன்,Ungalai patri naan satru kavalaiyaaga irukkiren,少し心配だよ,Sukoshi shinpai da yo
Take care of yourself,अपना ख्याल रखना,Apna khayal rakhna,स्वतःची काळजी घ्या,Svatahchi kalji ghya,உங்களை கவனித்துக்கொள்ளுங்கள்,Ungalai kavaniththukollungal,体に気をつけてね,Karada ni ki o tsukete ne
