English,Hindi,HinEnglish,Marathi,MarathiEnglish,Tamil,TamilEnglish,Japanese,Romanization
Everything happens for a reason, even if we don’t understand it at the time.,सब कुछ एक कारण से होता है, भले ही हम उस समय इसे न समझें।,Sab kuch ek karan se hota hai, bhale hi hum us samay ise na samjhein।,प्रत्येक गोष्ट एका कारणाने घडते, जरी आपल्याला तेव्हा ते समजत नसलं तरीही.,Pratyēka gōṣṭa ēkā kāraṇānē ghaḍatē, jarī āpalyālā tēvhā tē samajata nasalaṁ tarīhī.,எல்லாம் ஒரு காரணத்திற்காகவே நடக்கிறது, அந்த நேரத்தில் நாம் அதை புரிந்து கொள்ளாவிட்டாலும் கூட.,Ellām oru kāraṇattiṟkākavē naṭakkiṟatu, anta nērattil nām atai purintu koḷḷāviṭṭālum kūṭa.,すべてに理由がある。たとえその時理解できなくても。,Subete ni riyū ga aru. Tatoe sono toki rikai dekinakute mo.
You may not be able to save everyone, but you can still try.,तुम शायद सबको नहीं बचा पाओगे, लेकिन तुम फिर भी कोशिश कर सकते हो।,Tum shayad sabko nahi bacha paoge, lekin tum phir bhi koshish kar sakte ho।,तुम्ही सगळ्यांना वाचवू शकणार नाही, पण तुम्ही प्रयत्न करू शकता.,Tumhī sagḷyānnā vācavū śakaṇāra nāhī, paṇa tumhī prayatna karū śakatā.,உங்களால் எல்லோரையும் காப்பாற்ற முடியாமல் போகலாம், ஆனால் நீங்கள் முயற்சி செய்யலாம்.,Uṅkaḷāl ellōraiyum kāppāṟṟa muṭiyāmal pōkalām, āṉāl nīṅkaḷ muyarci ceyyalām.,すべての人を救うことはできないかもしれないが、それでも努力はできる。,Subete no hito o sukuu koto wa dekinai kamoshirenai ga, sore demo doryoku wa dekiru.
Life is like a puzzle; everything falls into place eventually.,जीवन एक पहेली की तरह है; सब कुछ अंततः अपनी जगह पर आ जाता है।,Jeevan ek paheli ki tarah hai; sab kuch antatah apni jagah par aa jata hai।,आयुष्य एका कोड्यासारखं आहे; शेवटी सर्व काही जागेवर येतं.,Āyuṣya ēkā kōḍyāsārakhaṁ āhe; śēvaṭī sarva kāhī jāgēvara yētaṁ.,வாழ்க்கை ஒரு புதிரைப் போன்றது; எல்லாம் இறுதியில் அதனதன் இடத்தில் வந்துவிடும்.,Vāḻkkai oru putiraip pōṉṟatu; ellām irutiyil ataṉataṉ iṭattil vantuvuṭum.,人生はパズルのようなもの。すべては最終的に元の場所に戻る。,Jinsei wa pazuru no yō na mono. Subete wa saishū-teki ni moto no basho ni modoru.
Time flies, but it’s up to us to make the most of it.,समय उड़ जाता है, लेकिन इसका सबसे अच्छा उपयोग करना हम पर निर्भर करता है।,Samay ud jata hai, lekin iska sabse achha upyog karna hum par nirbhar karta hai।,वेळ निघून जाते, पण तिचा चांगला उपयोग करणे आपल्यावर अवलंबून आहे.,Vēḷa nighūna jātē, paṇa ticā cāṅgalā upayōga karaṇē āpalyāvara avalaṁbūna āhe.,நேரம் பறந்து செல்கிறது, ஆனால் அதைப் பயன்படுத்துவது நம் பொறுப்பு.,Nēram paṟantu celkiṟatu, āṉāl ataip payaṉpaṭuttuvatu nam poṟuppu.,時間は飛ぶように過ぎていくが、それをどう使うかは自分次第だ。,Jikan wa tobu yō ni sugite iku ga, sore o dō tsukau ka wa jibun shidai da.
Sometimes the most beautiful things are the most fleeting.,कभी-कभी सबसे सुंदर चीजें सबसे क्षणिक होती हैं।,Kabhi-kabhi sabse sundar cheezein sabse kshanik hoti hain।,कधीकधी सर्वात सुंदर गोष्टी सर्वात क्षणिक असतात.,Kadhīkadhī sarvāta sundara gōṣṭī sarvāta kṣaṇika asatāta.,சில நேரங்களில் மிக அழகான விஷயங்கள் தான் மிக விரைவாக மறைந்துவிடும்.,Cila nēraṅkaḷil mika aḻakāṉa viṣayaṅkaḷ tāṉ mika virēvāka maṟaintuviṭum.,時には、最も美しいものは最も儚いものなんだ。,Toki ni wa, mottomo utsukushii mono wa mottomo hakanai mono nan da.
Life isn’t about finding yourself, it’s about creating yourself.,जीवन खुद को खोजने के बारे में नहीं है, यह खुद को बनाने के बारे में है।,Jeevan khud ko khojne ke bare mein nahi hai, yah khud ko banane ke bare mein hai।,आयुष्य म्हणजे स्वतःला शोधणे नाही, तर स्वतःला निर्माण करणे आहे.,Āyuṣya mhaṇajē svataḥlā śōdhaṇē nāhī, tara svataḥlā nirmāṇa karaṇē āhe.,வாழ்க்கை என்பது உங்களைக் கண்டுபிடிப்பது அல்ல, உங்களை உருவாக்குவது.,Vāḻkkai eṉpatu uṅkaḷaik kaṇṭupiṭippatu alla, uṅkaḷai uruvākkuvatu.,人生とは、自分を見つけることではなく、自分を創造することだ。,Jinsei to wa, jibun o mitsukeru koto de wa naku, jibun o sōzō suru koto da.
Sometimes, you just have to keep moving forward, even if you don’t know where you’re going.,कभी-कभी, आपको बस आगे बढ़ते रहना पड़ता है, भले ही आपको यह न पता हो कि आप कहाँ जा रहे हैं।,Kabhi-kabhi, aapko bas aage badhte rahna padta hai, bhale hi aapko yah na pata ho ki aap kahan ja rahe hain।,कधीकधी, तुम्हाला फक्त पुढे जात राहावं लागतं, जरी तुम्हाला माहीत नसलं तरी तुम्ही कुठे जात आहात.,Kadhīkadhī, tumhālā phakta puḍhē jāta rāhāvaṁ lāgataṁ, jarī tumhālā māhīta nasalaṁ tarī tumhī kuṭhē jāta āhāta.,சில நேரங்களில், நீங்கள் எங்கு செல்கிறீர்கள் என்று தெரியாவிட்டாலும், நீங்கள் முன்னோக்கிச் செல்ல வேண்டும்.,Cila nēraṅkaḷil, nīṅkaḷ eṅku celkiṟīrkaḷ eṉṟu teriyāviṭṭālum, nīṅkaḷ muṉṉōkkic cella vēṇṭum.,時には、どこへ向かっているかわからなくても、前へ進み続けるしかないんだ。,Toki ni wa, doko e mukatte iru ka wakaranakute mo, mae e susumi tsuzukeru shika nai n da.
Everything you do matters. Never forget that.,आप जो कुछ भी करते हैं, वह मायने रखता है। इसे कभी मत भूलना।,Aap jo kuch bhi karte hain, vah mayne rakhta hai. Ise kabhi mat bhoolna।,तुम्ही जे काही करता ते महत्त्वाचं आहे. हे कधीही विसरू नका.,Tumhī jē kāhī karatā tē mahatvācaṁ āhe. Hē kadhīhī visaraū nakā.,நீங்கள் செய்யும் அனைத்தும் முக்கியம். அதை ஒருபோதும் மறக்க வேண்டாம்.,Nīṅkaḷ ceyyum aṉaittum mukkiyam. Ataiy orupōtum maṟakka vēṇṭām.,君がすることすべてに意味がある。それを忘れるな。,Kimi ga suru koto subete ni imi ga aru. Sore o wasureru na.
Love is not something that just happens, it’s something you build over time.,प्यार सिर्फ ऐसा कुछ नहीं है जो बस हो जाता है, यह कुछ ऐसा है जिसे आप समय के साथ बनाते हैं।,Pyar sirf aisa kuch nahi hai jo bas ho jata hai, yah kuch aisa hai jise aap samay ke sath banate hain।,प्रेम फक्त असं काही नाहीये, जे फक्त घडतं, ते असं काही आहे जे तुम्ही वेळेनुसार तयार करता.,Prēma phakta asaṁ kāhī nāhīyē, jē phakta ghaḍataṁ, tē asaṁ kāhī āhe jē tumhī vēḷēnusāra tayāra karatā.,காதல் என்பது தானாக நடப்பது அல்ல, அது காலப்போக்கில் நீங்கள் உருவாக்குவது.,Kātal eṉpatu tāṉāka naṭappatu alla, atu kālappōkkil nīṅkaḷ uruvākkuvatu.,愛はただ起こるものではない、時間をかけて築き上げるものだ。,Ai wa tada okoru mono de wa nai, jikan o kakete kizukiageru mono da.
Dreams are the only things that will never disappear if you never give up on them.,सपने ही एकमात्र चीजें हैं जो कभी गायब नहीं होंगी अगर आप उन पर कभी हार नहीं मानते हैं।,Sapne hi ekmatra cheezein hain jo kabhi gayab nahi hongi agar aap un par kabhi har nahi mante hain।,स्वप्न ही एकमेव गोष्ट आहे जी तुम्ही हार मानली नाही तर कधीच नाहीशी होणार नाही.,Svapna hī ēkamēva gōṣṭa āhe jī tumhī hāra mānalī nāhī tara kadhīca nāhīśī hōṇāra nāhī.,நீங்கள் கனவுகளை ஒருபோதும் கைவிடவில்லை என்றால், அவை ஒருபோதும் மறைந்து போகாது.,Nīṅkaḷ kaṉavukaḷai orupōtum kaiviṭavillai eṉṟāl, avai orupōtum maṟaintu pōkātu.,夢は、諦めなければ決して消えない唯一のものだ。,Yume wa, akiramenakereba kesshite kienai yuiitsu no mono da.
The path to success is never easy, but it’s worth it.,सफलता का मार्ग कभी भी आसान नहीं होता, लेकिन यह इसके लायक है।,Saphalta ka marg kabhi bhi aasaan nahi hota, lekin yah iske layak hai।,यशाचा मार्ग कधीच सोपा नसतो, पण तो फायद्याचा असतो.,Yaśācā mārga kadhīca sōpā nasatō, paṇa tō phāyadyācā asatō.,வெற்றிக்கான பாதை எளிதானது அல்ல, ஆனால் அது மதிப்புமிக்கது.,Veṟṟikkāṉa pātai eḷitāṉatu alla, āṉāl atu matippumikkatu.,成功への道は決して簡単ではない、しかし、それには価値がある。,Seikō e no michi wa kesshite kantan de wa nai, shikashi, sore ni wa kachi ga aru.
One step at a time, and you’ll get there eventually.,एक समय में एक कदम, और आप आखिरकार वहां पहुँच जाएंगे।,Ek samay mein ek kadam, aur aap aakhirkar wahan pahunch jayenge।,एका वेळी एक पाऊल, आणि तुम्ही शेवटी तिथे पोहोचाल.,Ēkā vēḷī ēka pā'ūla, āṇi tumhī śēvaṭī tithē pōhōcāla.,ஒரு நேரத்தில் ஒரு படி, இறுதியில் நீங்கள் அங்கு செல்வீர்கள்.,Oru nērattil oru paṭi, irutiyil nīṅkaḷ aṅku celvīrkaḷ.,一歩ずつ進めば、いつか必ずたどり着く。,Ippo zutsu susumeba, itsuka kanarazu tadoritsuku.
It’s the journey that makes the destination worthwhile.,यह यात्रा है जो मंजिल को सार्थक बनाती है।,Yah yatra hai jo manzil ko sarthak banati hai।,प्रवासच गंतव्यस्थानाला फायद्याचा बनवतो.,Pravāsacaṁ gaṁtavyasthānālā phāyadyācā banavatō.,பயணம் தான் இலக்கை மதிப்புமிக்கதாக ஆக்குகிறது.,Payaṇam tāṉ ilakkai matippumikkātāka ākkukiṟatu.,目的地を価値あるものにするのは、旅そのものだ。,Mokutekichi o kachi aru mono ni suru no wa, tabi sono mono da.
Live for today, because tomorrow is never guaranteed.,आज के लिए जियो, क्योंकि कल की कोई गारंटी नहीं है।,Aaj ke liye jiyo, kyuki kal ki koi guarantee nahi hai।,आजसाठी जगा, कारण उद्याची कोणीही हमी देऊ शकत नाही.,Ājasāṭhī jagā, kāraṇa udyācī kōṇīhī hamī dē'ū śakata nāhī.,நாளைக்கு எந்த உத்தரவாதமும் இல்லாததால், இன்றுக்காக வாழுங்கள்.,Nāḷaikku enta uttaravātamum illātātāl, iṉṟukkāka vāḻuṅkaḷ.,明日が来る保証はないから、今日を生きろ。,Ashita ga kuru hoshō wa nai kara, kyō o ikiro.
Everything will be okay in the end. If it’s not okay, it’s not the end.,अंत में सब कुछ ठीक हो जाएगा। अगर यह ठीक नहीं है, तो यह अंत नहीं है।,Ant mein sab kuch theek ho jayega. Agar yah theek nahi hai, to yah ant nahi hai।,शेवटी सर्व काही ठीक होईल. जर ते ठीक नसेल, तर तो शेवट नाहीये.,Śēvaṭī sarva kāhī ṭhīka hō'īla. Jara tē ṭhīka nasēla, tara tō śēvaṭa nāhīyē.,எல்லாம் இறுதியில் நன்றாக இருக்கும். அது நன்றாக இல்லையென்றால், அது முடிவு அல்ல.,Ellām irutiyil naṉṟāka irukkum. Atu naṉṟāka illaiyeṉṟāl, atu muṭivu alla.,最後にはすべてうまくいく。もしうまくいかないなら、それはまだ終わりじゃない。,Saigo ni wa subete umaku iku. Moshi umaku ikanai nara, sore wa mada owari janai.
Just finished reading this amazing article on technology trends. Can't wait to apply some of these tips!,अभी-अभी प्रौद्योगिकी के रुझानों पर एक शानदार लेख पढ़ा है। इनमें से कुछ सुझावों को लागू करने का इंतजार नहीं कर सकता!,Abhi-abhi praudyogiki ke rujhano par ek shandar lekh padha hai. Inmein se kuch sujhavo ko lagu karne ka intezar nahi kar sakta!,तंत्रज्ञानाच्या ट्रेंड्सवरचा हा अप्रतिम लेख वाचून झाला. यातील काही टिप्स वापरण्यासाठी उत्सुक आहे!,Tantra-jñānācyā ṭrēṇḍsvaracā hā apratima lēkha vācūna jhālā. Yātīla kāhī ṭips vāparaṇyāsāṭhī utsuka āhē!,தொழில்நுட்பப் போக்குகள் பற்றிய இந்த அற்புதமான கட்டுரையை இப்போது படித்து முடித்தேன். இவற்றில் சில குறிப்புகளைப் பயன்படுத்த ஆவலுடன் இருக்கிறேன்!,Toḻilnuṭpap pōkkukaḷ paṟṟiya inta aṟputamāṉa kaṭṭuraiyai ippōtu paṭittu muṭittēṉ. Ivaṟṟil cila kuṟippukaḷaip payaṉpaṭutta āvaḷuṭaṉ irukkiṟēṉ!,テクノロジーのトレンドに関する素晴らしい記事を読み終えたばかりです。これらのヒントをいくつか応用するのが楽しみです！,Tekunorojī no torendo ni kansuru subarashī kiji o yomi-oeta bakari desu. Korera no hinto o ikutsu ka ōyō suru no ga tanoshimi desu!
Do you have a link? I'd love to check it out!,क्या आपके पास लिंक है? मैं इसे देखना पसंद करूँगा!,Kya aapke paas link hai? Main ise dekhna pasand karoonga!,तुमच्याकडे लिंक आहे का? मला ते बघायला आवडेल!,Tumacyākaḍē liṅka āhē kā? Malā tē baghāyalā āvaḍēla!,உங்களிடம் இணைப்பு இருக்கிறதா? அதை நான் பார்க்க விரும்புகிறேன்!,Uṅkaḷiṭam iṇaippu irukkiṟatā? Ata nān pārkka virumpukiṟēṉ!,リンクはありますか？ぜひ見てみたいです！,Rinku wa arimasu ka? Zehi mite mitai desu!
Feeling grateful for the little things in life today! 🌸 #grateful,आज जीवन में छोटी-छोटी बातों के लिए आभारी हूँ! 🌸 #आभारी,Aaj jeevan mein choti-choti baato ke liye aabhari hoon! 🌸 #aabhari,आज आयुष्यातल्या छोट्या छोट्या गोष्टींसाठी खूप आभारी आहे! 🌸 #grateful,Āja āyuṣyātlā chōṭyā chōṭyā gōṣṭīnsāṭhī khūpa ābhārī āhē! 🌸 #grateful,இன்று வாழ்க்கையின் சிறிய விஷயங்களுக்காக நன்றியுடன் உணர்கிறேன்! 🌸 #நன்றி,Iṉṟu vāḻkkaiyiṉ ciṟiya viṣayaṅkaḷukkāka naṉṟiyuṭaṉ uṇarkiṟēṉ! 🌸 #naṉṟi,今日は人生のささやかなことに感謝しています！🌸 #感謝,Kyō wa jinsei no sasayaka na koto ni kansha shite imasu!🌸 #kansha
Life's been hectic lately, but I'm trying to stay positive. 💪,हाल ही में जीवन व्यस्त रहा है, लेकिन मैं सकारात्मक रहने की कोशिश कर रहा हूँ। 💪,Haal hi mein jeevan vyast raha hai, lekin main sakaratmak rahne ki koshish kar raha hoon. 💪,अलीकडे आयुष्य खूप धावपळीचं आहे, पण मी सकारात्मक राहायचा प्रयत्न करत आहे. 💪,Alīkaḍē āyuṣya khūpa dhāva-paḷīcā āhē, paṇa mī sakārātmaka rāhāycā prayatna karata āhē. 💪,சமீபத்தில் வாழ்க்கை பரபரப்பாக உள்ளது, ஆனால் நான் நேர்மறையாக இருக்க முயற்சிக்கிறேன். 💪,Camīpattil vāḻkkai parapūpaka uḷḷatu, āṉāl nāṉ nērmaṟaiyāka irukka muyāṟcikkiṟēṉ. 💪,最近は忙しいけど、ポジティブでいようと頑張っています。💪,Saikin wa isogashii kedo, pojitibu de iyō to ganbatte imasu.💪
Anyone else having a hard time getting back into a routine after the holidays?,क्या छुट्टियों के बाद किसी और को भी रूटीन में वापस आने में मुश्किल हो रही है?,Kya chuttiyo ke baad kisi aur ko bhi routine mein wapas aane mein mushkil ho rahi hai?,सुट्ट्यांनंतर पुन्हा रुटीनमध्ये येणं कोणाला अवघड जात आहे का?,Suṭṭyāṁnantara puṇhā ruṭīnamadhyē yēṇā kōṇālā avaghaḍa jāta āhē kā?,விடுமுறைக்குப் பிறகு மீண்டும் வழக்கத்திற்கு திரும்புவது யாருக்காவது கடினமாக இருக்கிறதா?,Viṭumuṟaikkup piṟaku mīṇṭum vaḻakkattiṟku tirumpuvatu yārukkāvatu kaṭiṉamāka irukkiṟatā?,連休明けで日常のルーティンに戻るのが大変な人、他にいますか？,Renkyū-ake de nichijō no rūtin ni modoru no ga taihen na hito, hoka ni imasu ka?
Just booked a spontaneous trip to the beach! So excited!,अभी-अभी समुद्र तट की एक आकस्मिक यात्रा बुक की है! बहुत उत्साहित हूँ!,Abhi-abhi samudra tat ki ek aakasmik yatra book ki hai! Bahut utsahith hoon!,आत्ताच अचानक बीचवर जायचं ठरवलं! खूप उत्सुक आहे!,Āttāca acānaka bīcavara jāyacaṁ ṭharavalaṁ! Khūpa utsuka āhē!,திடீரென்று கடற்கரைக்கு ஒரு பயணத்தை முன்பதிவு செய்தேன்! மிகவும் உற்சாகமாக இருக்கிறது!,Tiṭīreṉṟu kaṭaṟkaraikku oru payaṇattai muṉpativu ceytēṉ! Mikavum uṟcākamāka irukkiṟatu!,急に思い立ってビーチへの旅行を予約しました！すごく楽しみ！,Kyū ni omoitatte bīchi e no ryokō o yoyaku shimashita! Sugoku tanoshimi!
How can it be raining again? I need some sunshine!,फिर से बारिश कैसे हो सकती है? मुझे थोड़ी धूप चाहिए!,Phir se baarish kaise ho sakti hai? Mujhe thodi dhoop chahiye!,परत पाऊस कसा काय? मला थोडी सूर्यप्रकाश पाहिजे!,Parata pā'ūsa kasā kāya? Malā thōḍī sūryaprakāśa pāhijē!,மீண்டும் எப்படி மழை பெய்கிறது? எனக்கு கொஞ்சம் சூரிய ஒளி வேண்டும்!,Mīṇṭum eppaṭi maḻai peykiṟatu? Eṉakku koñcam sūriya oḷi vēṇṭum!,また雨が降ってるなんて信じられない！太陽の光が欲しい！,Mata ame ga futteru nante shinjirarenai! Taiyō no hikari ga hoshii!
I love how cozy this sweater is! Perfect for fall weather.,मुझे यह स्वेटर कितना आरामदायक लगता है! शरद ऋतु के मौसम के लिए बिल्कुल सही है।,Mujhe yah sweater kitna aaramdayak lagta hai! Sharad ritu ke mausam ke liye bilkul sahi hai.,हा स्वेटर किती आरामदायक आहे हे मला खूप आवडतं! शरद ऋतूच्या हवामानासाठी एकदम योग्य आहे.,Hā svēṭara kitī ārāmadāyaka āhē hē malā khūpa āvaḍataṁ! Śarada ṛtūcyā havāmānāsāṭhī ēkadama yōgya āhē.,இந்த ஸ்வெட்டர் எவ்வளவு வசதியாக இருக்கிறது என்று எனக்குப் பிடிக்கும்! இலையுதிர் காலத்திற்கு ஏற்றது.,Inta sveṭṭar evaḷavu vacatiyāka irukkiṟatu eṉṟu eṉakkup piṭikkum! Ilaiyutir kālattiṟku ēṟṟatu!,このセーター、すごく着心地がいい！秋の天気にぴったりだね。,Kono sētā, sugoku kikogochi ga ii! Aki no tenki ni pittari da ne.
I've been binge-watching this new series all weekend. Can't stop!,मैं इस सप्ताहांत में इस नई सीरीज़ को लगातार देख रहा हूँ। रोक नहीं सकता!,Main is saptahant mein is nayi series ko lagatar dekh raha hoon. Rok nahi sakta!,मी हा वीकेंड पूर्णपणे ही नवीन सिरीज पाहण्यात घालवला. आता थांबताच येत नाहीये!,Mī hā vīkēṇḍa pūrṇapaṇē hī navīna sirīja pāhaṇyāta ghālavalā. Ātā thāmbaṭāca yēta nāhīyē!,இந்த வார இறுதி முழுவதும் இந்த புதிய தொடரை நான் தொடர்ந்து பார்த்துக் கொண்டிருக்கிறேன். நிறுத்த முடியவில்லை!,Inta vāra iruti muḻuvatum inta putiya toṭarai nāṉ toṭarntu pārttuk koṇṭirukkiṟēṉ. Niṟutta muṭiyavillai!,この週末、新しいシリーズを一気見しちゃった。止まらない！,Kono shūmatsu, atarashii shirīzu o ikkimi shichatta. Tomaranai!
