English,Hindi,HinEnglish,Marathi,MarathiEnglish,Tamil,TamilEnglish,Japanese,Romanization
I went to the market to buy some fresh vegetables and fruits.,मैं ताजा सब्जियाँ और फल खरीदने बाजार गया।,Main taaza sabziyaan aur phal khareedne bazaar gaya.,मी ताज्या भाज्या आणि फळे विकत घेण्यासाठी बाजारात गेलो.,Mee taajya bhaajya ani phale vikat ghanyasathi bazaarat gelo.,தाजா காய்கறிகள் மற்றும் பழங்களை வாங்குவதற்காக சந்தைக்கு சென்றேன்.,Thaaja kaaykariangal mattum pazhangalai vaanguvatharkaaga santhaikku sendren.,新鮮な野菜と果物を買うために市場に行きました。,Shinsen na yasai to kudamono o kau tame ni ichiba ni ikimashita.
She is reading a very interesting book these days.,ये दिनों वह एक बहुत रोचक किताब पढ़ रही है।,Ye dino woh ek bahut rochak kitaab padh rahi hai.,ती या दिवसी एक खूपच रोचक पुस्तक वाचत आहे।,Tee ya divasi ek khoopach rochak pustak vaachat ahe.,இந்த நாட்களில் அவள் ஒரு மிகவும் சுவாரஸ்யமான புத்தகத்தை படித்துக் கொண்டிருக்கிறாள்.,Indha naatkalin aval oru mikavum suvaarasyaana puththagathai padiththuk kondirukkiraal.,彼女は最近とても面白い本を読んでいます。,Kanojo wa saikin totemo omoshiroi hon o yonde imasu.
We are planning to visit our grandparents this weekend.,हम इस वीकेंड अपने दादा-दादी से मिलने की योजना बना रहे हैं।,Hum is weekend apne dada-dadi se milne ki yojana bana rahe hain.,आम्ही या शनिवार-रविवारी आमच्या आजोबा-आजीला भेटण्याची योजना आखत आहोत।,Aamhi ya shanivaar-ravivaari aamchya aajoba-aajila bhetanyaachi yojana aakhat aahot.,நாங்கள் இந்த வார இறுதியில் எங்கள் பாட்டி பாட்டாவை சந்திக்க திட்டமிட்டுள்ளோம்.,Naangal indha vaara iruthiyil engal paatti paattaavai santhikka thittamittullaam.,今週末、祖父母を訪ねる予定です。,Konshuumatsu, sofubo o tazuneru yotei desu.
They have decided to start a new business venture together.,उन्होंने मिलकर एक नया व्यवसाय शुरू करने का फैसला किया है।,Unhone milkar ek naya vyavasaay shuru karne ka faisla kiya hai.,ते मिळून एक नवीन व्यवसाय सुरू करण्याचा निर्णय घेतला आहे।,Te miloon ek naveen vyavasaay suru karanyaacha nirnay ghetla ahe.,அவர்கள் ஒன்றாக ஒரு புதிய வணிக முயற்சியை தொடங்குவதென முடிவு செய்துள்ளனர்.,Avargal orrupaaga oru puthiya vaniga muyarchiyai thodanguvathena mudivu seithullaar.,彼らは一緒に新しいビジネスを始めることにしました。,Karera issho ni atarashii bijinesu o hajimeru koto ni shimashita.
The children are playing in the park and enjoying the sunny weather.,बच्चे पार्क में खेल रहे हैं और धूप का आनंद ले रहे हैं।,Bacche park mein khel rahe hain aur dhoop ka anand le rahe hain.,मुले उद्यानात खेळत आहेत आणि उजेडाचा आनंद घेत आहेत।,Mule udyaanat khelt aahot ani ujedacha anand ghet aahot.,குழந்தைகள் பூங்காவில் விளையாடி கொண்டு சூரிய வானிலையை அனுபவித்துக் கொண்டிருக்கிறார்கள்.,Kuzhandhaigal poongaa vil vilaiyaadi kondru sooriya vaanilai anubaviththuk kondirukkiraar.,子供たちは公園で遊んでいて、晴れた天気を楽しんでいます。,Kodomotachi wa kouen de asonde ite, hareta tenki o tanoshinde imasu.
He is working hard to complete his project on time.,वह अपने प्रोजेक्ट को समय पर पूरा करने के लिए कड़ी मेहनत कर रहा है।,Woh apne project ko samay par poora karne ke liye kadi mehnat kar raha hai.,तो त्याचा प्रकल्प वेळेत पूर्ण करण्यासाठी कठोर परिश्रम करत आहे।,To tyacha prakalp velit poorn karanyasathi kathor parishram karat ahe.,அவர் தன்னுடைய திட்டத்தை தேர்ந்த நேரத்தில் முடிக்க கடுமையாக உழைக்கிறார்.,Avar thannudaiya thittai theerntha nerathil mudikka kadumaaga uzhaikkirar.,彼はプロジェクトを時間通りに完成させるために一生懸命働いています。,Kare wa purojekuto o jikan doori ni kansei saseru tame ni isshoukenmei hataraite imasu.
She loves to cook delicious meals for her family.,वह अपने परिवार के लिए स्वादिष्ट भोजन पकाना पसंद करती है।,Woh apne parivaar ke liye swaadisht bhojan pakana pasand karti hai.,ती तिच्या कुटुंबासाठी छान जेवण बनवणे आवडते।,Tee tichya kutumbasathi chaan jevan banavne aavdte.,அவர் தனது குடும்பத்திற்காக ருசியான உணவுகளை சமைக்க விரும்புகிறார்.,Avar thanatha kutumpathirkaaga rusiyaana unavugalai samaikk virumpukirar.,彼女は家族のために美味しい料理を作るのが大好きです。,Kanojo wa kazoku no tame ni oishii ryouri o tsukuru no ga daisuki desu.
We enjoyed a wonderful vacation at the beach last summer.,पिछले गर्मियों में हमने समुद्र तट पर एक अद्भुत छुट्टी का आनंद लिया।,Pichle garmiyon mein humne samudra tat par ek adbhut chhutti ka anand liya.,गेल्या उन्हाळ्यात आम्ही समुद्रकिनारी एक अद्भुत सुट्टीचा आनंद लुटला।,Gelya unhaalyat aamhi samudrakinari ek adbhut sutteecha anand lutla.,கடந்த கோடையில் நாங்கள் கடற்கரையில் ஒரு அற்புதமான விடுமுறையை அனுபவித்தோம்.,Kadandha kodaiyil naangal kadarkaraiyil oru arputamaana vidumuraiyai anubavithom.,私たちは去年の夏、ビーチで素晴らしい休暇を楽しみました。,Watashitachi wa kyonen no natsu, biichi de subarashii kyuuka o tanoshimimashita.
They are looking forward to the upcoming festival.,वे आगामी उत्सव का बेसब्री से इंतजार कर रहे हैं।,We aagami utsav ka besabri se intzaar kar rahe hain.,ते आगामी सणाची आतुरतेने वाट पाहत आहेत।,Te aagami sanaachi aaturtene vaat paahat aahot.,அவர்கள் வரவிருக்கும் திருவிழாவை ஆவலுடன் எதிர்பார்த்துக் கொண்டிருக்கிறார்கள்.,Avargal varavirukkum thiruvizhaavai aavaludan ethirpaarthuk kondirukkiraar.,彼らは今後の祭りを楽しみにしています。,Karera kongo no matsuri o tanoshimi ni shite imasu.
The teacher explained the lesson clearly to the students.,शिक्षक ने छात्रों को पाठ स्पष्ट रूप से समझाया।,Shikshak ne chhatron ko paath spashht roop se samjhaya.,शिक्षकाने विद्यार्थ्यांना धडा स्पष्टपणे समजावला।,Shikshakane vidyaarthyaanna dhada spashhtapane samajaavla.,ஆசிரியர் மாணவர்களுக்கு பாடத்தை தெளிவாக விளக்கினார்.,Aasiriyar maanavarkalukku paadathai thelivaga vilakkinar.,先生は生徒たちにレッスンをはっきりと説明しました。,Sensei wa seito-tachi ni ressun o hakkiri to setsumei shimashita.
She bought a beautiful dress for the party.,उसने पार्टी के लिए एक सुंदर पोशाक खरीदी।,Usne party ke liye ek sundar poshaak khareedi.,तिने पार्टीसाठी एक सुंदर पोशाख विकत घेतला।,Tine partiesaathi ek sundar poshaak vikat ghetla.,அவர் விழாவிற்கு ஒரு அழகான உடை வாங்கினார்.,Avar vizhaavukku oru azhagaana udai vaanginaar.,彼女はパーティーのために美しいドレスを買いました。,Kanojo wa paatii no tame ni utsukushii doresu o kaimashita.
We need to finish this task by tomorrow.,हमें कल तक इस कार्य को पूरा करने की आवश्यकता है।,Hamein kal tak is kaary ko poora karne ki aavashyakta hai.,आम्हाला उद्या पर्यंत हे काम पूर्ण करणे आवश्यक आहे।,Aamhaala udyaa paryant he kaam poorn karane aavashyak ahe.,நாங்கள் இந்த பணியை நாளை முடிக்க வேண்டும்.,Naangal indha paniyai naalai mudikka vendum.,私たちは明日までにこのタスクを終える必要があります。,Watashitachi wa ashita made ni kono tasuku o oeru hitsuyou ga arimasu.
He is very excited about his new job.,वह अपनी नई नौकरी के बारे में बहुत उत्साहित है।,Woh apni nai naukri ke baare mein bahut utsaahit hai.,तो त्याच्या नवनोकरीबद्दल खूप उत्साहित आहे।,To tyachya navnokribaddal khoop utsaahit ahe.,அவர் தனது புதிய வேலை குறித்து மிகவும் உற்சாகமாக உள்ளார்.,Avar thanatha puthiya velai kurithu mikavum urchaagam ullaar.,彼は新しい仕事にとても興奮しています。,Kare wa atarashii shigoto ni totemo koufun shite imasu.
She always helps her neighbors in need.,वह हमेशा जरूरतमंद पड़ोसियों की मदद करती है।,Woh hamesha zaruratmand padosiyon ki madad karti hai.,ती सदैव गरजू शेजाऱ्यांना मदत करते।,Tee sadaiv garju shejaaryaanna madat karte.,அவர் எப்போதும் தன்னுடைய அண்டை வீட்டாருக்கு தேவையான உதவிகளை செய்கிறார்.,Avar eppothum thannudaiya andai veettaarkku thevaiyaana uthavigalai seykirar.,彼女は常に困っている近所の人々を助けます。,Kanojo wa tsune ni komatte iru kinjo no hitobito o tasukemasu.
They are planning a surprise party for their friend.,वे अपने दोस्त के लिए एक सरप्राइज पार्टी की योजना बना रहे हैं।,We apne dost ke liye ek surprise party ki yojana bana rahe hain.,ते त्यांच्या मित्रासाठी एक आश्चर्य पार्टीची योजना आखत आहेत।,Te tyanya mitrasaathi ek aashcharya partieshi yojana aakhat aahot.,அவர்கள் தங்கள் நண்பருக்கு ஒரு சுர்ப்ரைஸ் பார்ட்டியை திட்டமிடுகிறார்கள்.,Avargal thangal nanbarukku oru surprise partyai thittamidukiraar.,彼らは友達のためにサプライズパーティーを計画しています。,Karera tomodachi no tame ni supuraizu paatii o keikaku shite imasu.
The weather is perfect for a picnic today.,आज पिकनिक के लिए मौसम बिल्कुल परफेक्ट है।,Aaj picnic ke liye mausam bilkul perfect hai.,आज पिकनिकसाठी हवामान पूर्णपणे परफेक्ट आहे।,Aaj pikniksaathi havaamaan poornapane perfect ahe.,இன்று piknikக்காக வானிலை முற்றிலும் சிறந்தது.,Indru picnicukkaaga vaanilai mutrilum sirandhadhu.,今日はピクニックに最適な天気です。,Kyou wa pikunikku ni saiteki na tenki desu.
He is learning to play the guitar.,वह गिटार बजाना सीख रहा है।,Woh guitar bajana seekh raha hai.,तो गिटार वाजवणे शिकत आहे।,To guitar vaajavne shikat ahe.,அவர் கிதார் வாசிப்பதை கற்றுக் கொண்டிருக்கிறார்.,Avar kithaar vaasippathai kattuk kondirukkirar.,彼はギターを弾くことを学んでいます。,Kare wa gitaa o hiku koto o manande imasu.
She is very happy with her new car.,वह अपनी नई कार से बहुत खुश है।,Woh apni nai car se bahut khush hai.,ती तिच्या नवनवीन कारने खूप आनंदी आहे।,Tee tichya navanaveen kaarne khoop aanandi ahe.,அவர் தனது புதிய காரில் மிகவும் மகிழ்ச்சியாக உள்ளார்.,Avar thanatha puthiya kaaril mikavum makizhchiyaga ullaar.,彼女は新しい車にとても満足しています。,Kanojo wa atarashii kuruma ni totemo manzoku shite imasu.
We are going to watch a movie tonight.,हम आज रात एक फिल्म देखने जा रहे हैं।,Hum aaj raat ek film dekhne ja rahe hain.,आम्ही आज रात्री एक चित्रपट पाहणार आहोत।,Aamhi aaj raatri ek chitrapat paahnaar aahot.,நாங்கள் இன்று இரவு ஒரு திரைப்படம் பார்க்கப் போகிறோம்.,Naangal indru iravu oru thiraipadaam paarkka pokiroam.,私たちは今晩映画を見に行きます。,Watashitachi wa konban eiga o mi ni ikimasu.
They have adopted a cute puppy.,उन्होंने एक प्यारा सा पिल्ला गोद लिया है।,Unhone ek pyaara sa pup god liya hai.,ते एक छान शावक दत्तक घेतले आहे।,Te ek chaan shaavak dattak ghetle ahe.,அவர்கள் ஒரு அழகான குட்டி நாயை தத்தெடுத்துள்ளனர்.,Avargal oru azhagaana kutti naayai thatheduthullaar.,彼らはかわいい子犬を飼うことにしました。,Karera kawaii koinu o kau koto ni shimashita.
The chef prepared a delicious meal for us.,शेफ ने हमारे लिए एक स्वादिष्ट भोजन तैयार किया।,Chef ne hamare liye ek swaadisht bhojan taiyaar kiya.,शेफने आमच्या साठी एक छान जेवण तयार केले।,Chefne aamchya saathi ek chaan jevan taiyaar kele.,செப் நமக்காக ஒரு ருசியான உணவை தயார் செய்தார்.,Chep namakkaaga oru rusiyaana unavai thayaar seithaar.,シェフは私たちのために美味しい食事を準備しました。,Shefu wa watashi-tachi no tame ni oishii shokuji o junbi shimashita.
She is practicing yoga every morning.,वह हर सुबह योगाभ्यास कर रही है।,Woh har subah yogaabhyaas kar rahi hai.,ती प्रत्येक सकाळी योगाचा सराव करत आहे।,Tee pratyek sakaali yogaacha saraav karat ahe.,அவர் ஒவ்வொரு காலையும் யோகா பயிற்சி செய்கிறார்.,Avar ovvoru kaalaiyum yoga payirchi seykirar.,彼女は毎朝ヨガを練習しています。,Kanojo wa maiasa yoga o renshuu shite imasu.
We need to book our tickets in advance.,हमें अपनी टिकटें पहले से बुक करनी चाहिए।,Hamein apni ticketain pehle se book karni chahiye.,आम्हाला आमच्या तिकिटे आधी बुक करायला हव्यात।,Aamhaala aamchya tikite aadhi book karaayla havyaat.,நாங்கள் நமது டிக்கெட்டுகளை முன்கூட்டியே புக் செய்ய வேண்டும்.,Naangal namadhu ticketkugalai munkoottiyae book seyyavendum.,私たちはチケットを前もって予約する必要があります。,Watashitachi wa chiketto o maemotte yoyaku suru hitsuyou ga arimasu.
He is very good at playing football.,वह फुटबॉल खेलने में बहुत अच्छा है।,Woh football khelne mein bahut accha hai.,तो फुटबॉल खेळण्यात खूप चांगला आहे।,To football khelnyat khoop chaangla ahe.,அவர் கால்பந்து விளையாடுவதில் மிகவும் நல்லவர்.,Avar kaalpanthu vilaiyaaduvathil mikavum nallavar.,彼はサッカーをするのがとても上手です。,Kare wa sakkaa o suru no ga totemo jouzu desu.
She is looking for a new job.,वह एक नई नौकरी की तलाश कर रही है।,Woh ek nai naukri ki talaash kar rahi hai.,ती एक नवनोकरी शोधत आहे।,Tee ek navnokri shodhat ahe.,அவர் ஒரு புதிய வேலையை தேடுகிறார்.,Avar oru puthiya velaiyai thedukirar.,彼女は新しい仕事を探しています。,Kanojo wa atarashii shigoto o sagashite imasu.
They are going to celebrate their anniversary next month.,वे अगले महीने अपनी वर्षगांठ मनाने जा रहे हैं।,We agle mahine apni varshagaanth manaane ja rahe hain.,ते पुढच्या महिन्यात त्यांची वर्धापनदिन साजरा करणार आहेत।,Te pudhchya mahinyaat tyaanchi vardhaapandin saajraa karanaar aahot.,அவர்கள் அடுத்த மாதம் அவர்களின் ஆண்டு விழாவை கொண்டாட உள்ளனர்.,Avargal adutha maatham avargalin aandu vizhaavai kondadullaar.,彼らは来月、記念日を祝う予定です。,Karera raigetsu, kinenbi o iwau yotei desu.
The garden is full of beautiful flowers.,बगीचा खूबसूरत फूलों से भरा हुआ है।,Bagicha khoobsurat phulon se bhara hua hai.,बगिचा सुंदर फुलांनी भरलेला आहे।,Bagicha sundar phulanni bharlela ahe.,தோட்டம் அழகிய பூக்களால் நிரம்பியுள்ளது.,Thottam azhagiya pookkalal nirambiyulladhu.,庭は美しい花でいっぱいです。,Niwa wa utsukushii hana de ippai desu.
She is very talented in painting.,वह चित्रकला में बहुत प्रतिभाशाली है।,Woh chitrakala mein bahut pratibhaashaali hai.,ती चित्रकलेत खूप हावी आहे।,Tee chitrakalet khoop haavi ahe.,அவர் ஓவியத்தில் மிகவும் திறமைசாலி.,Avar oviyam thil mikavum thiramaichali.,彼女は絵を描くのがとても上手です。,Kanojo wa e o egaku no ga totemo jouzu desu.
We are going to visit our relatives during the holidays.,हम छुट्टियों के दौरान अपने रिश्तेदारों से मिलने जा रहे हैं।,Hum chhuttiyon ke dauran apne rishtedaaron se milne ja rahe hain.,आम्ही सुट्टीच्या दिवसी आमच्या नातेवाईकांना भेटणार आहोत।,Aamhi sutteechya divasi aamchya naatevaaikaanna bhetanaar aahot.,நாங்கள் விடுமுறை நாட்களில் எங்கள் உறவினர்களை சந்திக்கப் போகிறோம்.,Naangal vidumurai naatkalin engal uravinargalai santhikka pokiroam.,私たちは休暇中に親戚を訪ねる予定です。,Watashitachi wa kyuuka chuu ni shinseki o tazuneru yotei desu.
He is very proud of his achievements.,वह अपनी उपलब्धियों पर बहुत गर्व महसूस कर रहा है।,Woh apni upalabdhiyon par bahut garv mahasoos kar raha hai.,तो त्याच्या उपलब्धीवर खूप अभिमान वाटत आहे।,To tyachya upalabdhivar khoop abhimaan vaatat ahe.,அவர் தனது சாதனைகளில் மிகவும் பெருமை கொள்கிறார்.,Avar thanatha saadanaigalin mikavum perumai kolkirar.,彼は自分の達成にとても誇りを持っています。,Kare wa jibun no tassei ni totemo hokori o motte imasu.
She is very kind and always helps others.,वह बहुत दयालु है और हमेशा दूसरों की मदद करती है।,Woh bahut dayaalu hai aur hamesha doosron ki madad karti hai.,ती खूप दयाळू आहे आणि सदैव इतरांना मदत करते।,Tee khoop dayaalu ahe ani sadaiv itraanna madat karte.,அவர் மிகவும் கருணையுள்ளவர் மற்றும் எப்போதும் மற்றவர்களுக்கு உதவுகிறார்.,Avar mikavum karunaiyullavar mattum eppothum matravarkalukku uthavukirar.,彼女はとても親切で、いつも他人の助けになります。,Kanojo wa totemo shinsetsu de, itsumo tanin no tasuke ni narimasu.
They are planning to buy a new house.,वे एक नया घर खरीदने की योजना बना रहे हैं।,We ek naya ghar khareedne ki yojana bana rahe hain.,ते एक नवीन घर विकत घेण्याची योजना आखत आहेत।,Te ek naveen ghar vikat ghenyaachi yojana aakhat aahot.,அவர்கள் ஒரு புதிய வீடு வாங்க திட்டமிட்டுள்ளனர்.,Avargal oru puthiya veedu vaanga thittamittullaar.,彼らは新しい家を買う計画を立てています。,Karera atarashii ie o kau keikaku o tate te imasu.
The children are excited about the school trip.,बच्चे स्कूल ट्रिप को लेकर उत्साहित हैं।,Bacche school trip ko lekar utsaahit hain.,मुले शाळा प्रवासाबद्दल उत्साहित आहेत।,Mule shaalaa pravaasaabaddal utsaahit aahot.,குழந்தைகள் பள்ளி பயணம் குறித்து உற்சாகமாக உள்ளனர்.,Kuzhandhaigal palli payanam kurithu urchaagam ullaar.,子供たちは学校の遠足を楽しみにしています。,Kodomotachi wa gakkou no ensoku o tanoshimi ni shite imasu.
She is very happy with her new job.,वह अपनी नई नौकरी से बहुत खुश है।,Woh apni nai naukri se bahut khush hai.,ती तिच्या नवनोकरीने खूप आनंदी आहे।,Tee tichya navnokrine khoop aanandi ahe.,அவர் தனது புதிய வேலையில் மிகவும் மகிழ்ச்சியாக உள்ளார்.,Avar thanatha puthiya velaiyil mikavum makizhchiyaga ullaar.,彼女は新しい仕事にとても満足しています。,Kanojo wa atarashii shigoto ni totemo manzoku shite imasu.
He is learning to play the piano.,वह पियानो बजाना सीख रहा है।,Woh piano bajana seekh raha hai.,तो पियानो वाजवणे शिकत आहे।,To piano vaajavne shikat ahe.,அவர் பியானோ வாசிப்பதை கற்றுக் கொண்டிருக்கிறார்.,Avar piyaano vaasippathai kattuk kondirukkirar.,彼はピアノを弾くことを学んでいます。,Kare wa piano o hiku koto o manande imasu.
