English,Hindi,HinEnglish,Marathi,MarathiEnglish,Tamil,TamilEnglish,Japanese,Romanization
I don't know,मुझे नहीं पता,Mujhe nahin pata,मला माहीत नाही,Mala maahit nahi,எனக்கு தெரியாது,Enakku teriyadhu,分かりません,Wakarimasen
I understand,मैं समझ गया,Main samajh gaya,मी समजलो,Mee samajlo,புரிந்துகொண்டேன்,Purinthukonden,分かりました,Wakarimashita
I don't understand,मैं समझा नहीं,Main samajh nahin,मी समजले नाही,Mee samjale nahi,புரியவில்லை,Puriyavillai,分かりません,Wakarimasen
Where do you live?,आप कहाँ रहते हैं?,Aap kahaan rehte hain?,तुमी कुठे राहता?,Tumi kuthe raahata?,நீங்கள் எங்கே வசிக்கிறீர்கள்?,Neengal enga vasikkirargal?,どこに住んでいますか?,Doko ni sundeimasu ka?
I live in...,मैं... में रहता हूँ,Main... mein rehta hoon,मी... मध्ये राहतो,Mee... madhye raahato,நான்...ல் வசிக்கிறேன்,Naan...il vasikkiren,私は...に住んでいます,Watashi wa... ni sundeimasu
What do you do?,आप क्या करते हैं?,Aap kya karte hain?,तुमी काय करता?,Tumi kay karata?,நீங்கள் என்ன செய்கிறீர்கள்?,Neengal enna seygirargal?,何をしていますか?,Nani o shiteimasu ka?
I am a student,मैं एक छात्र हूँ,Main ek chhatra hoon,मी एक विद्यार्थी आहे,Mee ek vidyaarthi ahe,நான் ஒரு மாணவர்,Naan oru maanaavar,私は学生です,Watashi wa gakusei desu
I am a teacher,मैं एक शिक्षक हूँ,Main ek shikshak hoon,मी एक शिक्षक आहे,Mee ek shikshak ahe,நான் ஒரு ஆசிரியர்,Naan oru aasiriyar,私は教師です,Watashi wa kyoushi desu
I am a doctor,मैं एक डॉक्टर हूँ,Main ek doctor hoon,मी एक डॉक्टर आहे,Mee ek doctor ahe,நான் ஒரு மருத்துவர்,Naan oru maruththuvar,私は医者です,Watashi wa isha desu
I am an engineer,मैं एक इंजीनियर हूँ,Main ek engineer hoon,मी एक अभियंता आहे,Mee ek abhiyanta ahe,நான் ஒரு பொறியாளர்,Naan oru poriyalar,私はエンジニアです,Watashi wa enjiniya desu
I am a nurse,मैं एक नर्स हूँ,Main ek nurse hoon,मी एक परिचारिका आहे,Mee ek paracharika ahe,நான் ஒரு செவிலியர்,Naan oru sevilayar,私は看護師です,Watashi wa kangoshi desu
I am a chef,मैं एक शेफ हूँ,Main ek chef hoon,मी एक स्वयंपाकी आहे,Mee ek swayampaki ahe,நான் ஒரு சமையல்காரர்,Naan oru samaiyalkaarar,私はシェフです,Watashi wa shefu desu
I am a police officer,मैं एक पुलिस अधिकारी हूँ,Main ek police adhikari hoon,मी एक पुलिस अधिकारी आहे,Mee ek police adhikari ahe,நான் ஒரு காவல் அதிகாரி,Naan oru kaaval adhigari,私は警察官です,Watashi wa keisatsukan desu
I am a firefighter,मैं एक अग्निशमन कर्मी हूँ,Main ek agnishaman karmi hoon,मी एक अग्निशामक आहे,Mee ek agnishaamak ahe,நான் ஒரு தீயணைப்பு வீரர்,Naan oru theeyanaippu veerar,私は消防士です,Watashi wa shouboushi desu
I am a farmer,मैं एक किसान हूँ,Main ek kisan hoon,मी एक शेतकरी आहे,Mee ek shetkari ahe,நான் ஒரு விவசாயி,Naan oru vivasaayi,私は農家です,Watashi wa nouka desu
I am a scientist,मैं एक वैज्ञानिक हूँ,Main ek vaigyanik hoon,मी एक शास्त्रज्ञ आहे,Mee ek shaastragya ahe,நான் ஒரு அறிவியலாளர்,Naan oru araviyalalar,私は科学者です,Watashi wa kagakusha desu
I am a writer,मैं एक लेखक हूँ,Main ek lekhak hoon,मी एक लेखक आहे,Mee ek lekhak ahe,நான் ஒரு எழுத்தாளர்,Naan oru ezhuththalar,私は作家です,Watashi wa sakka desu
I am an artist,मैं एक कलाकार हूँ,Main ek kalakaar hoon,मी एक कलाकार आहे,Mee ek kalakaar ahe,நான் ஒரு கலைஞர்,Naan oru kalainjar,私は芸術家です,Watashi wa geijutsuka desu
I am a musician,मैं एक संगीतकार हूँ,Main ek sangeetkaar hoon,मी एक संगीतकार आहे,Mee ek sangeetkaar ahe,நான் ஒரு இசையமைப்பாளர்,Naan oru isaiyammaippaalar,私は音楽家です,Watashi wa ongakuka desu
I am a dancer,मैं एक नर्तक हूँ,Main ek nartak hoon,मी एक नर्तक आहे,Mee ek nartak ahe,நான் ஒரு நடனக் கலைஞர்,Naan oru natanak kalainjar,私はダンサーです,Watashi wa dansaa desu
I am a singer,मैं एक गायक हूँ,Main ek gaayak hoon,मी एक गायक आहे,Mee ek gaayak ahe,நான் ஒரு பாடகர்,Naan oru paadagar,私は歌手です,Watashi wa kashu desu
I am an actor,मैं एक अभिनेता हूँ,Main ek abhinetta hoon,मी एक अभिनेता आहे,Mee ek abhinetta ahe,நான் ஒரு நடிகர்,Naan oru nadigar,私は俳優です,Watashi wa haiyuu desu
I am a photographer,मैं एक फोटोग्राफर हूँ,Main ek photographer hoon,मी एक छायाचित्रकार आहे,Mee ek chhaayaachitrakar ahe,நான் ஒரு புகைப்படக் கலைஞர்,Naan oru pugai padak kalainjar,私は写真家です,Watashi wa shashinka desu
I am a journalist,मैं एक पत्रकार हूँ,Main ek patrakaar hoon,मी एक पत्रकार आहे,Mee ek patrakaar ahe,நான் ஒரு பத்திரிகையாளர்,Naan oru pattirikaiaalar,私はジャーナリストです,Watashi wa jaanarisuto desu
I am a lawyer,मैं एक वकील हूँ,Main ek vakeel hoon,मी एक वकील आहे,Mee ek vakeel ahe,நான் ஒரு வக்கீல்,Naan oru vakkeel,私は弁護士です,Watashi wa bengoshi desu
I am a pilot,मैं एक पायलट हूँ,Main ek pilot hoon,मी एक विमानचालक आहे,Mee ek vimaanchaalak ahe,நான் ஒரு விமானி,Naan oru vimaani,私はパイロットです,Watashi wa pairotto desu
I am a soldier,मैं एक सैनिक हूँ,Main ek sainik hoon,मी एक सैनिक आहे,Mee ek sainik ahe,நான் ஒரு வீரர்,Naan oru veerar,私は兵士です,Watashi wa heishi desu
I am a sailor,मैं एक नाविक हूँ,Main ek naavik hoon,मी एक नाविक आहे,Mee ek naavik ahe,நான் ஒரு கப்பல் வீரர்,Naan oru kappal veerar,私は船員です,Watashi wa sen'in desu
I am a mechanic,मैं एक मकैनिक हूँ,Main ek mechanic hoon,मी एक यांत्रिकी आहे,Mee ek yaantriki ahe,நான் ஒரு மெக்கானிக்,Naan oru mekkaanik,私は整備士です,Watashi wa seibishi desu
I am a carpenter,मैं एक बढ़ई हूँ,Main ek badhai hoon,मी एक सुतार आहे,Mee ek sutaar ahe,நான் ஒரு மர வேலையாளர்,Naan oru mara velaiyaalar,私は大工です,Watashi wa daiku desu
I am a plumber,मैं एक प्लंबर हूँ,Main ek plumber hoon,मी एक नळकार आहे,Mee ek nalkaar ahe,நான் ஒரு குழாயடைப்பாளர்,Naan oru kuzhaadappaalar,私は配管工です,Watashi wa haikangou desu
I am an electrician,मैं एक इलेक्ट्रिशियन हूँ,Main ek electrician hoon,मी एक विद्युतकार आहे,Mee ek vidyutkaar ahe,நான் ஒரு மின்விசை ஆளும்,Naan oru minvisai aalum,私は電気技師です,Watashi wa denki gishi desu
I am a painter,मैं एक चित्रकार हूँ,Main ek chitrakar hoon,मी एक चित्रकार आहे,Mee ek chitrakar ahe,நான் ஒரு ஓவியர்,Naan oru oviyar,私は画家です,Watashi wa gaka desu
I am a sculptor,मैं एक मूर्तिकार हूँ,Main ek moortikaar hoon,मी एक शिल्पकार आहे,Mee ek shilpakaar ahe,நான் ஒரு சிற்பி,Naan oru sirpi,私は彫刻家です,Watashi wa choukoku ka desu
I am a architect,मैं एक वास्तुकार हूँ,Main ek vaastukaar hoon,मी एक वास्तुविशारद आहे,Mee ek vaastuvishaarad ahe,நான் ஒரு கட்டிடக் கலைஞர்,Naan oru kattidak kalainjar,私は建築家です,Watashi wa kenchikuka desu
I am a designer,मैं एक डिजाइनर हूँ,Main ek designer hoon,मी एक डिझायनर आहे,Mee ek dizainar ahe,நான் ஒரு வடிவமைப்பாளர்,Naan oru vadivamaippaalar,私はデザイナーです,Watashi wa dezainaa desu
I am a programmer,मैं एक प्रोग्रामर हूँ,Main ek programmer hoon,मी एक प्रोग्रामर आहे,Mee ek programmer ahe,நான் ஒரு நிரலாளர்,Naan oru niralalar,私はプログラマーです,Watashi wa puroguramaa desu
I am a businessman,मैं एक व्यापारी हूँ,Main ek vyaapaari hoon,मी एक व्यापारी आहे,Mee ek vyaapaari ahe,நான் ஒரு வணிகர்,Naan oru vanigar,私は実業家です,Watashi wa jitsugyousha desu
I am a shopkeeper,मैं एक दुकानदार हूँ,Main ek dukaandaar hoon,मी एक दुकानदार आहे,Mee ek dukaandaar ahe,நான் ஒரு கடைக்காரர்,Naan oru kadaikkaarar,私は店主です,Watashi wa tenshu desu
I am a fisherman,मैं एक मछुआरा हूँ,Main ek machhuaara hoon,मी एक मासेमारी आहे,Mee ek maasemaari ahe,நான் ஒரு மீனவர்,Naan oru meenavar,私は漁師です,Watashi wa ryoushi desu
I am a baker,मैं एक बेकर हूँ,Main ek baker hoon,मी एक बेकर आहे,Mee ek baker ahe,நான் ஒரு பேக்கர்,Naan oru bekkar,私はパン職人です,Watashi wa pan shokunin desu
I am a butcher,मैं एक कसाई हूँ,Main ek kasaai hoon,मी एक कसाई आहे,Mee ek kasaai ahe,நான் ஒருறைச்சிக் கடைக்காரர்,Naan oru raichik kadaikkaarar,私は肉屋です,Watashi wa nikuya desu
I am a tailor,मैं एक दर्जी हूँ,Main ek darzi hoon,मी एक शिंपी आहे,Mee ek shimpi ahe,நான் ஒரு தையல்காரர்,Naan oru thaiyalkaarar,私は仕立て屋です,Watashi wa shitateya desu
I am a gardener,मैं एक माली हूँ,Main ek maali hoon,मी एक माली आहे,Mee ek maali ahe,நான் ஒரு தோட்டக்காரர்,Naan oru thottakkaarar,私は庭師です,Watashi wa niwashi desu
I am a driver,मैं एक ड्राइवर हूँ,Main ek driver hoon,मी एक ड्रायव्हर आहे,Mee ek driver ahe,நான் ஒரு ஓட்டுனர்,Naan oru ottunar,私は運転手です,Watashi wa untenshu desu
I am a conductor,मैं एक कंडक्टर हूँ,Main ek conductor hoon,मी एक वाहक आहे,Mee ek vaahak ahe,நான் ஒரு கடத்துனர்,Naan oru kadattunar,私は車掌です,Watashi wa shashou desu
I am a librarian,मैं एक लाइब्रेरियन हूँ,Main ek librarian hoon,मी एक ग्रंथपाल आहे,Mee ek granthapaal ahe,நான் ஒரு நூலகர்,Naan oru noolagar,私は司書です,Watashi wa shisho desu
I am a postman,मैं एक डाकिया हूँ,Main ek daakiya hoon,मी एक पोस्टमन आहे,Mee ek postman ahe,நான் ஒரு அஞ்சல் தபால்,Naan oru anjal thapaal,私は郵便配達人です,Watashi wa yuubin haitatsunin desu
I am a barber,मैं एक नाई हूँ,Main ek naai hoon,मी एक नाई आहे,Mee ek naai ahe,நான் ஒரு நாவிதர்,Naan oru naavidhar,私は理容師です,Watashi wa riyoushi desu
I am a hairdresser,मैं एक हेयरड्रेसर हूँ,Main ek hairdresser hoon,मी एक केशकर्ता आहे,Mee ek keshakarta ahe,நான் ஒரு முடத்திருத்தி,Naan oru mudathiruthi,私は美容師です,Watashi wa biyoushi desu
I am a model,मैं एक मॉडल हूँ,Main ek model hoon,मी एक मॉडेल आहे,Mee ek model ahe,நான் ஒரு மாடல்,Naan oru maadal,私はモデルです,Watashi wa moderu desu
I am an athlete,मैं एक एथलीट हूँ,Main ek athlete hoon,मी एक क्रिडापटू आहे,Mee ek kridaapatu ahe,நான் ஒரு விளையாட்டு வீரர்,Naan oru vilaiyaattu veerar,私はアスリートです,Watashi wa asuriito desu
I am a coach,मैं एक कोच हूँ,Main ek coach hoon,मी एक प्रशिक्षक आहे,Mee ek prashikshak ahe,நான் ஒரு பயிற்றுவிப்பாளர்,Naan oru payirruvippaalar,私はコーチです,Watashi wa koochi desu
I am a referee,मैं एक रेफरी हूँ,Main ek referee hoon,मी एक पंच आहे,Mee ek panch ahe,நான் ஒரு நடுவர்,Naan oru naduvar,私は審判です,Watashi wa shinpan desu
I am a player,मैं एक खिलाड़ी हूँ,Main ek khilaadi hoon,मी एक खेळाडू आहे,Mee ek khelaadu ahe,நான் ஒரு விளையாட்டு வீரர்,Naan oru vilaiyaattu veerar,私は選手です,Watashi wa senshu desu
I am a fan,मैं एक प्रशंसक हूँ,Main ek prashansak hoon,मी एक चाहता आहे,Mee ek chaahata ahe,நான் ஒரு ரசிகர்,Naan oru rasigar,私はファンです,Watashi wa fan desu
I am a tourist,मैं एक पर्यटक हूँ,Main ek paryatak hoon,मी एक पर्यटक आहे,Mee ek paryatak ahe,நான் ஒரு சுற்றுலாப் பயணி,Naan oru suttrulaap payani,私は観光客です,Watashi wa kankoukyaku desu
I am a guide,मैं एक गाइड हूँ,Main ek guide hoon,मी एक मार्गदर्शक आहे,Mee ek maargadarshak ahe,நான் ஒரு வழிகாட்டி,Naan oru vazhikaatti,私はガイドです,Watashi wa gaido desu
I am a translator,मैं एक अनुवादक हूँ,Main ek anuvaadak hoon,मी एक भाषांतरकार आहे,Mee ek bhaashaantarkaar ahe,நான் ஒரு மொழிபெயர்ப்பாளர்,Naan oru mozhi peyarppalar,私は翻訳者です,Watashi wa honyakusha desu
I am an interpreter,मैं एक दुभाषिया हूँ,Main ek dubhaashiya hoon,मी एक दुभाषी आहे,Mee ek dubhaashi ahe,நான் ஒரு மொழிபெயர்ப்பாளர்,Naan oru mozhi peyarppalar,私は通訳です,Watashi wa tsuyaku desu
I am a volunteer,मैं एक स्वयंसेवक हूँ,Main ek swayamsevak hoon,मी एक स्वयंसेवक आहे,Mee ek swayamsevak ahe,நான் ஒரு தன்னார்வலர்,Naan oru thannaarvalar,私はボランティアです,Watashi wa borantia desu
I am a donor,मैं एक दाता हूँ,Main ek daata hoon,मी एक दाता आहे,Mee ek daata ahe,நான் ஒரு நன்கொடையாளர்,Naan oru nankodaiyaalar,私は寄付者です,Watashi wa kifusha desu
I am a recipient,मैं एक प्राप्तकर्ता हूँ,Main ek praaptakarta hoon,मी एक प्राप्तकर्ता आहे,Mee ek praaptakarta ahe,நான் ஒரு பெறுநர்,Naan oru perunar,私は受取人です,Watashi wa uketorinin desu
I am a member,मैं एक सदस्य हूँ,Main ek sadasya hoon,मी एक सदस्य आहे,Mee ek sadasya ahe,நான் ஒரு உறுப்பினர்,Naan oru uruppinar,私はメンバーです,Watashi wa menbaa desu
I am a leader,मैं एक नेता हूँ,Main ek netaa hoon,मी एक नेता आहे,Mee ek netaa ahe,நான் ஒரு தலைவர்,Naan oru thalaivar,私はリーダーです,Watashi wa riidaa desu
I am a follower,मैं एक अनुयायी हूँ,Main ek anuyaayi hoon,मी एक अनुयायी आहे,Mee ek anuyaayi ahe,நான் ஒரு பின்தொடர்பவர்,Naan oru pindhodarppavar,私はフォロワーです,Watashi wa frowaa desu
I am a friend,मैं एक दोस्त हूँ,Main ek dost hoon,मी एक मित्र आहे,Mee ek mitra ahe,நான் ஒரு நண்பர்,Naan oru nanbar,私は友達です,Watashi wa tomodachi desu
I am an enemy,मैं एक दुश्मन हूँ,Main ek dushman hoon,मी एक शत्रू आहे,Mee ek shatru ahe,நான் ஒரு பகைவர,Naan oru pagaivar,私は敵です,Watashi wa teki desu
I am a neighbor,मैं एक पड़ोसी हूँ,Main ek padosi hoon,मी एक शेजारी आहे,Mee ek shejaari ahe,நான் ஒரு அயலான்,Naan oru ayalaan,私は隣人です,Watashi wa rinjin desu
I am a colleague,मैं एक सहकर्मी हूँ,Main ek sahakarmi hoon,मी एक सहकारी आहे,Mee ek sahakaari ahe,நான் ஒரு同僚,Naan oru dourou,私は同僚です,Watashi wa dourou desu
I am a boss,मैं एक बॉस हूँ,Main ek boss hoon,मी एक मालक आहे,Mee ek maalak ahe,நான் ஒரு boss,Naan oru boss,私はボスです,Watashi wa bosu desu
I am an employee,मैं एक कर्मचारी हूँ,Main ek karmachaari hoon,मी एक कर्मचारी आहे,Mee ek karmachaari ahe,நான் ஒரு ஊழியர்,Naan oru uzhiyar,私は従業員です,Watashi wa juugyouin desu
I am a customer,मैं एक ग्राहक हूँ,Main ek graahak hoon,मी एक ग्राहक आहे,Mee ek graahak ahe,நான் ஒரு வாடிக்கையாளர்,Naan oru vaadikkaiyaalar,私はお客様です,Watashi wa okyakusama desu
I am a seller,मैं एक विक्रेता हूँ,Main ek vikreta hoon,मी एक विक्रेता आहे,Mee ek vikreta ahe,நான் ஒரு விற்பனையாளர்,Naan oru virpanaiyaalar,私は売り手です,Watashi wa urite desu
I am a buyer,मैं एक खरीददार हूँ,Main ek khareedaar hoon,मी एक खरेदीदार आहे,Mee ek kharedidar ahe,நான் ஒரு வாங்குபவர்,Naan oru vaangupavar,私は買い手です,Watashi wa kaite desu
I am a trader,मैं एक व्यापारी हूँ,Main ek vyaapaari hoon,मी एक व्यापारी आहे,Mee ek vyaapaari ahe,நான் ஒரு வணிகர்,Naan oru vanigar,私はトレーダーです,Watashi wa toreidaa desu
I am a merchant,मैं एक व्यापारी हूँ,Main ek vyaapaari hoon,मी एक व्यापारी आहे,Mee ek vyaapaari ahe,நான் ஒரு வணிகர்,Naan oru vanigar,私は商人です,Watashi wa shounin desu
I am a supplier,मैं एक आपूर्तिकर्ता हूँ,Main ek aapoortikarta hoon,मी एक पुरवठादार आहे,Mee ek puravathaadaar ahe,நான் ஒரு சப்ளையர்,Naan oru saplayar,私は供給者です,Watashi wa kyuukyuusha desu
I am a manufacturer,मैं एक निर्माता हूँ,Main ek nirmaata hoon,मी एक उत्पादक आहे,Mee ek utpaadak ahe,நான் ஒரு உற்பத்தியாளர்,Naan oru urpattiyalar,私はメーカーです,Watashi wa meikaa desu
I am a producer,मैं एक निर्माता हूँ,Main ek nirmaata hoon,मी एक निर्माता आहे,Mee ek nirmaata ahe,நான் ஒரு தயாரிப்பாளர்,Naan oru thayaarippaalar,私はプロデューサーです,Watashi wa purosuuaa desu
I am a director,मैं एक निर्देशक हूँ,Main ek nirdeshak hoon,मी एक दिग्दर्शक आहे,Mee ek digdarshak ahe,நான் ஒரு இயக்குனர்,Naan oru iyakkunar,私はディレクターです,Watashi wa direkutaa desu
I am a manager,मैं एक प्रबंधक हूँ,Main ek prabandhak hoon,मी एक व्यवस्थापक आहे,Mee ek vyavasthaapak ahe,நான் ஒரு மேலாளர்,Naan oru melalar,私はマネージャーです,Watashi wa maneejaa desu
I am an assistant,मैं एक सहायक हूँ,Main ek sahaayak hoon,मी एक सहायक आहे,Mee ek sahaayak ahe,நான் ஒரு உதவியாளர்,Naan oru uthaviyalar,私はアシスタントです,Watashi wa ashisutanto desu
I am a secretary,मैं एक सचिव हूँ,Main ek sachiv hoon,मी एक सचिव आहे,Mee ek sachiv ahe,நான் ஒரு செயலர்,Naan oru seyalar,私は秘書です,Watashi wa hisho desu
I am a receptionist,मैं एक रिसेप्शनिस्ट हूँ,Main ek receptionist hoon,मी एक स्वागतकर्ता आहे,Mee ek svaagatakarta ahe,நான் ஒரு வரவேற்பாளர்,Naan oru varavaerppalar,私は受付係です,Watashi wa uketsuke kakari desu
I am a security guard,मैं एक सुरक्षा गार्ड हूँ,Main ek suraksha guard hoon,मी एक सुरक्षा रक्षक आहे,Mee ek suraksha rakshak ahe,நான் ஒரு பாதுகாவலர்,Naan oru paadhukaavalar,私は警備員です,Watashi wa keibiin desu
I am a cleaner,मैं एक सफाई कर्मचारी हूँ,Main ek safai karmachaari hoon,मी एक स्वच्छताकर्मी आहे,Mee ek swachchhataakarmi ahe,நான் ஒரு சுத்தம் செய்பவர்,Naan oru suththam seipavar,私は清掃員です,Watashi wa seisouin desu
I am a cook,मैं एक रसोइया हूँ,Main ek rasoiya hoon,मी एक स्वयंपाकी आहे,Mee ek swayampaaki ahe,நான் ஒரு சமையல்காரர்,Naan oru samaiyalkaarar,私はコックです,Watashi wa kokku desu
I am a waiter,मैं एक वेटर हूँ,Main ek waiter hoon,मी एक वेटर आहे,Mee ek waiter ahe,நான் ஒரு வைட்டர்,Naan oru vaittar,私はウェイターです,Watashi wa ueitaa desu
I am a bartender,मैं एक बारटेंडर हूँ,Main ek bartender hoon,मी एक बारटेंडर आहे,Mee ek bartender ahe,நான் ஒரு பார் டெண்டர்,Naan oru baar tendar,私はバーテンダーです,Watashi wa baatendaa desu
I am a cashier,मैं एक कैशियर हूँ,Main ek cashier hoon,मी एक रोकडेकर आहे,Mee ek rokdekar ahe,நான் ஒரு காசாளர்,Naan oru kaasaalar,私はキャッシャーです,Watashi wa kyasshaa desu
I am a clerk,मैं एक क्लर्क हूँ,Main ek clerk hoon,मी एक लिपिक आहे,Mee ek lipik ahe,நான் ஒரு எழுத்தர்,Naan oru ezhuththar,私は事務員です,Watashi wa jimuin desu
I am a consultant,मैं एक सलाहकार हूँ,Main ek salaahkaar hoon,मी एक सल्लागार आहे,Mee ek sallaagaar ahe,நான் ஒரு ஆலோசகர்,Naan oru aalochagar,私はコンサルタントです,Watashi wa konsarutanto desu
I am an analyst,मैं एक विश्लेषक हूँ,Main ek vishleshak hoon,मी एक विश्लेषक आहे,Mee ek vishleshak ahe,நான் ஒரு பகுப்பாய்வாளர்,Naan oru pakuppaayvaalar,私はアナリストです,Watashi wa anarisuto desu
